date,source,titre,sentiment,intensite,intensite_rank,horizon,confiance,catalyseur,tickers_affectes,resume_impact,risque_contraire,raisonnement,lien
2026-04-27 19:46:11,Seeking Alpha,Intel Confirms Another Gold Mine Segment In Semiconductors,positif,modere,2,1-3mois,80,produit,KGC,"Intel a confirmé un segment or en matière de semi-conducteurs, ce qui pourrait stimuler la demande pour les actions de KGC.",facteur invalidant,"L'annonce de nouvelles découvertes d'or en matière de semi-conducteurs chez Intel pourrait augmenter la confiance des investisseurs en la croissance du secteur, possiblement en raison d'une meilleure efficacité ou de nouvelles applications.",https://seekingalpha.com/article/4894722-intel-confirms-another-gold-mine-segment-in-semiconductors?source=feed_all_articles
2026-04-27 19:46:12,Yahoo/GS,"Goldman Sachs, JPMorgan sharply diverge on quantum computing",positif,modere,2,intraday,80,technologique,GS,"La divergence de stratégie entre Goldman Sachs et JPMorgan concernant le calcul quantique pourrait indiquer une anticipation de gains futurs pour Goldman Sachs, possiblement grâce à une avance technologique.",faible,"Goldman Sachs semble avoir une vision optimiste sur l'impact potentiel du calcul quantique sur ses opérations financières, ce qui pourrait stimuler l'intérêt pour ses actions. Cette orientation technologique positive pourrait aider à expliquer la hausse récente du cours de l'action GS.",https://www.thestreet.com/crypto/markets/goldman-sachs-jpmorgan-sharply-diverge-on-quantum-computing?.tsrc=rss
2026-04-27 19:56:47,CNBC,Gold is winning against the dollar as nations manage global strife. Deutsche Bank sees bullion prices surging,positif,modere,2,1-2sem,80,macro,DB,L'augmentation de l'or comme réserve de valeur par les banques centrales et la baisse de l'exposition aux devises américaines pourrait soutenir la performance de Deutsche Bank.,Une dégradation des conditions économiques mondiales pourrait contrecarrer cette tendance.,"L'augmentation de l'or, considéré comme un refuge en cas de crise, pourrait continuer à profiter de l'instabilité politique et économique mondiale, influençant positivement les actions des compagnies impliquées dans l'or, telles que Deutsche Bank.",https://www.cnbc.com/2026/04/27/gold-is-winning-out-against-the-dollar-as-nations-manage-global-strife.html
2026-04-27 19:56:49,Yahoo/AVGO,Broadcom's Q2 2026 Earnings: What to Expect,positif,fort,3,1-3mois,85,earnings,AVGO,"La prévision de croissance des bénéfices pour Broadcom au cours du deuxième trimestre prochain est positive, anticipant une hausse significative du cours de l'action.",facteur invalidant,"Broadcom, une entreprise de composants électroniques de premier plan, prévoit une croissance des bénéfices en hausse de plus de 8% pour le trimestre prochain, ce qui est largement supérieur aux attentes du marché. Cette performance est catalysée par les résultats financiers réussis de la concurrence, poussant ainsi les investisseurs à anticiper une hausse du cours de l'action AVGO.",https://www.barchart.com/story/news/1536788/broadcom-s-q2-2026-earnings-what-to-expect?.tsrc=rss
2026-05-03 12:47:01,Yahoo Finance,"Broadcom, Viking, Rio Tinto Lead Five Stocks Near Buy Points As Market Revs",positif,fort,3,intraday,80,produit,AVGO,La hausse de 0.7% sur 5 jours pour AVGO indique une augmentation de popularité possiblement liée à des nouvelles récentes ou des performances financières encourageantes.,facteur invalidant,L'augmentation de la valeur de AVGO pourrait être stimulée par des nouvelles sur les perspectives de croissance ou des améliorations significatives dans le secteur technologique.,https://www.investors.com/news/broadcom-stock-market-viking-rio-tinto-dycom-wabtec-sp-500-dow-jones-nasdaq/?src=A00220&yptr=yahoo
2026-05-03 12:47:02,Yahoo/ALAB,"Should You Buy, Sell or Hold ALAB Stock Before Q1 Earnings Release?",positif,modere,2,1-3mois,75,earnings,ALAB,"Astera Labs annonce des revenus en croissance grâce à son expansion dans le domaine de l'intelligence artificielle, mais la pression sur les marges et une forte valorisation pourraient limiter les gains.",facteur invalidant,L'augmentation de 3.1% sur les 5 derniers jours indique une tendance positive. La présence d'une croissance forte dans le secteur de l'intelligence artificielle pourrait encourager les investisseurs à anticiper une hausse du cours de ALAB avant la publication des résultats du premier trimestre.,https://finance.yahoo.com/markets/stocks/articles/buy-sell-hold-alab-stock-163000739.html?.tsrc=rss
2026-05-03 12:47:03,Yahoo/ALAB,What an Astera Labs Golden Cross Tells Investors About the Next Leg Up,positif,fort,3,1-2sem,80,produit,ALAB,La croissance de Astera Labs indique un changement de momentum favorables pour les investisseurs.,Une augmentation des coûts de production ou une mauvaise gestion pourrait contrecarrer ce momentum.,La hausse de 3.1% sur 5 jours et le golden cross sur le graphique technique sont des indicateurs positifs pour l'avenir de la compagnie.,https://247wallst.com/investing/2026/04/30/what-an-astera-labs-golden-cross-tells-investors-about-the-next-leg-up/?.tsrc=rss
2026-05-03 12:47:05,Yahoo/AVGO,"Dow Jones Futures: Stock Market Hits High After Bullish Pause; Apple, Broadcom In Buy Zones",positif,modere,2,intraday,85,macro,AVGO,Le rebond du marché boursier après une pause brève est encouragé par l'indication que des actions spécifiques comme Apple et Broadcom sont dans des zones d'achat.,Une baisse des taux d'intérêt ou une dégradation des perspectives économiques pourrait contrecarrer cette tendance positive.,"L'augmentation des actions spécifiques comme Apple et Broadcom dans des zones d'achat peut indiquer une forte pression acheteuse. Cependant, l'impact est modéré car le contexte général de la hausse du marché reste macroéconomique et non directement lié à des nouvelles spécifiques d'entreprises.",https://finance.yahoo.com/m/cfdf164e-e24a-366b-9d8b-b0274f05ba94/dow-jones-futures%3A-stock.html?.tsrc=rss
2026-05-03 12:47:06,Yahoo/AVGO,Is Broadcom (AVGO) One of the Best American Tech Stocks to Buy?,positif,modere,2,1-3mois,85,produit,AVGO,La déclaration de lancement de nouveaux produits Wi-Fi 8 et PON par Broadcom renforce sa position de leader dans le secteur de la bande passante.,aucun,"Les nouveaux produits sont une amélioration majeure pour la croissance future de Broadcom, renforçant ainsi la valeur des actions.",https://finance.yahoo.com/sectors/technology/articles/broadcom-avgo-one-best-american-223952363.html?.tsrc=rss
2026-05-03 12:47:07,Yahoo/AVGO,"Broadcom, Viking, Rio Tinto Lead Five Stocks Near Buy Points As Market Revs",positif,modere,2,intraday,80,M&A,AVGO,"Les actions de Broadcom, une entreprise de composants électroniques, montrent des signes d'achat. Cela pourrait être encouragé par des perspectives d'achats croissantes et des perspectives de croissance dans le secteur des composants électroniques.",Chute des taux d'intérêt mondiaux pourrait affecter négativement les perspectives de croissance des entreprises technologiques.,"Broadcom, qui est l'une des principales entreprises du secteur, annonce des résultats financiers prometteurs et des perspectives d'expansion. Cela pourrait augmenter la confiance des investisseurs et conduire à une hausse des prix.",https://finance.yahoo.com/m/86759845-aca9-3fa5-943d-cb6ae3de1e02/broadcom%2C-viking%2C-rio-tinto.html?.tsrc=rss
2026-05-03 12:47:09,Yahoo/AVGO,How Investors Are Reacting To Broadcom (AVGO) Embedding AppNeta Observability Inside Google Cloud,positif,modere,2,1-3mois,80,M&A,AVGO,"La collaboration entre Broadcom et Google Cloud pour intégrer AppNeta Observability dans Google Cloud améliore la surveillance des performances des entreprises pour les applications complexes AI et cloud, potentiellement augmentant la valeur des actions de Broadcom.",Une mauvaise intégration technologique ou des régulations changeantes pourrait affecter négativement l'augmentation attendue des cours des actions de Broadcom.,"L'expansion de la collaboration entre deux leaders technologiques peut stimuler une croissance future des revenus et de la part de marché pour Broadcom, reflétée dans une augmentation anticipée des cours de ses actions.",https://finance.yahoo.com/markets/stocks/articles/investors-reacting-broadcom-avgo-embedding-021339411.html?.tsrc=rss
2026-05-03 12:47:10,Yahoo/AVGO,The First $6 Trillion Company May Not Be Nvidia,negatif,fort,3,intraday,80,produit,NVDA,La baisse de la valeur de Nvidia (NVDA) est principalement due à la hausse des perspectives de croissance d'Alphabet (GOOGL) sur le marché de l'intelligence artificielle et du cloud.,facteur invalidant,"Alphabet (GOOGL) se rapproche de la supériorité de marché de Nvidia (NVDA) en raison de ses activités dans le domaine de l'intelligence artificielle et du cloud, ce qui affecte négativement le cours de NVDA.",https://finance.yahoo.com/m/b246014e-b62f-3722-8a0b-f30af3a07666/the-first-%246-trillion-company.html?.tsrc=rss
2026-05-03 12:47:11,Yahoo/DB,Deutsche Bank Reaffirms Buy on Intuit (INTU) After TurboTax Survey Insights,positif,modere,2,1-2sem,80,produit,DB,Deutsche Bank renforce son recommandation d'achat sur Intuit suite à une étude sur TurboTax.,facteur invalidant,L'augmentation de la confiance est due à l'amélioration de la position de Intuit dans le secteur des logiciels de déclaration de revenus suite à cette étude favorable.,https://finance.yahoo.com/markets/stocks/articles/deutsche-bank-reaffirms-buy-intuit-075152576.html?.tsrc=rss
2026-05-03 12:47:12,Yahoo/DB,Deutsche Bank Keeps Hold Rating on AMD Ahead of Q1 Results,positif,modere,2,1-3mois,80,earnings,DB,"Le maintien du rating Hold par Deutsche Bank sur Advanced Micro Devices, Inc. (AMD) avant les résultats du premier trimestre pourrait indiquer une anticipation positive concernant les résultats de la compagnie.",Une réelle mauvaise performance des résultats de AMD pourrait contredire le maintien du rating Hold et potentiellement affecter négativement le cours de la banque Deutsche Bank.,Deutsche Bank maintient un rating Hold sur AMD avec un objectif de prix de 250$ suite à des attentes de résultats forts pour le premier trimestre. Cette décision pourrait être soutenue par des prévisions de croissance des ventes et des bénéfices pour AMD.,https://finance.yahoo.com/sectors/technology/articles/deutsche-bank-keeps-hold-rating-224031215.html?.tsrc=rss
2026-05-03 12:47:14,Yahoo/DB,Deutsche Bank Aktiengesellschaft Q1 Earnings Call Highlights,negatif,modere,2,intraday,70,earnings,DB,"Le début de l'année 2026 pour Deutsche Bank est prometteur avec des bénéfices records et une amélioration des indicateurs de rentabilité, mais la baisse du cours de l'action de 2.5% indique une certaine insatisfaction sur le marché.",facteur invalidant,"L'annonce de bénéfices records est en réalité un résultat positif, mais le niveau de baisse du cours de l'action et la réaction du marché indiquent une certaine préoccupation quant à la croissance future.",https://www.marketbeat.com/instant-alerts/deutsche-bank-aktiengesellschaft-q1-earnings-call-highlights-2026-05-01/?utm_source=yahoofinance&utm_medium=yahoofinance&.tsrc=rss
2026-05-03 12:47:15,Yahoo/GS,"Goldman Sachs Touts Record Q1 2026, Launches AI-Driven “One Goldman Sachs 3.0” at Annual Meeting",positif,modere,2,1-3mois,80,earnings,GS,"Goldman Sachs a signalé des résultats record pour le premier trimestre de 2026, indiquant une croissance significative.",La volatilité du marché financier pourrait contrecarrer l'effet positif sur les actions de GS.,"L'utilisation d'une technologie avancée comme l'IA dans le cadre de 'One Goldman Sachs 3.0' pourrait renforcer la performance future de l'entreprise, anticipant ainsi une augmentation du cours de son action.",https://www.marketbeat.com/instant-alerts/goldman-sachs-touts-record-q1-2026-launches-ai-driven-one-goldman-sachs-30-at-annual-meeting-2026-05-02/?utm_source=yahoofinance&utm_medium=yahoofinance&.tsrc=rss
2026-05-03 12:47:16,Yahoo/GS,How The Investment Narrative For XPO (XPO) Is Shifting With New Targets And Assumptions,positif,modere,2,1-2sem,80,macro,XPO,"Le changement de cible de valeur juste pour XPO indique une augmentation potentielle du prix de l'action, influencée par les analyses plus optimistes des banques comme JPMorgan et Goldman Sachs.",Une baisse des taux d'intérêt ou une mauvaise performance économique pourrait contrecarrer cette tendance.,"L'augmentation de la cible de valeur pourrait être due à des prévisions plus optimistes concernant les performances futures de XPO, possiblement soutenues par des conditions macroéconomiques favorables.",https://finance.yahoo.com/markets/stocks/articles/investment-narrative-xpo-xpo-shifting-200821715.html?.tsrc=rss
2026-05-03 12:47:17,Yahoo/GS,"Goldman Sachs says the S&P 500's run past 7,100 is 'froth' — a previous time Wall Street said that, a crash followed",negatif,modere,2,intraday,80,macro,GS,"Le titre de Goldman Sachs indique une préoccupation concernant l'excès de la hausse du S&P 500 au-delà de 7,100, suggérant que cela pourrait être considéré comme une bulle. Cette observation pourrait être un signe d'une possible correction sur le marché.",facteur invalidant,"L'augmentation des prix pourrait être surévaluée en raison de l'excès d'optimisme (FOMO - Fear of Missing Out), ce qui pourrait entraîner une correction. Le titre GS, qui est touché, pourrait refléter cette préoccupation.",https://finance.yahoo.com/markets/stocks/articles/goldman-sachs-says-p-500s-194500078.html?.tsrc=rss
2026-05-03 12:47:19,Yahoo/IMNM,Immunome Announces Submission of New Drug Application to U.S. FDA for Varegacestat for the Treatment of Adults with Desmoid Tumors,positif,modere,2,1-2sem,80,réglementaire,IMNM,"Immunome a soumis une demande de nouveau médicament pour varegacestat auprès de l'Agence américaine de médicaments, ce qui pourrait améliorer l'attractivité de la société dans le secteur des traitements du cancer.",facteur invalidant,"La soumission de l'NDA pour varegacestat est un événement positif pour Immunome, indiquant une avancée dans le processus de régulation pour le traitement des tumeurs des mamelons. Cependant, le sentiment est modéré car il s'agit d'un développement intermédiaire et non d'un résultat définitif.",https://finance.yahoo.com/sectors/healthcare/articles/immunome-announces-submission-drug-application-113000871.html?.tsrc=rss
